{
  "type": "dotnet-build",
  "taskId": "FV-P01-T001",
  "method": "dotnet build Fluent.sln --no-restore",
  "startedAt": "2026-07-12T08:05:19.7940517Z",
  "finishedAt": "2026-07-12T08:05:28.2373416Z",
  "exitCode": 0,
  "status": "PASS",
  "summary": "Phase 01 build succeeded.",
  "logPath": "docs/project/evidence/phase-01/dotnet-build.log"
}
