{
  "type": "dotnet-test",
  "taskId": "FV-P01-T001",
  "method": "dotnet test Fluent.sln --no-build",
  "startedAt": "2026-07-12T08:05:28.4152554Z",
  "finishedAt": "2026-07-12T08:05:54.1488711Z",
  "exitCode": 0,
  "status": "PASS",
  "summary": "Phase 01 automated tests passed.",
  "logPath": "docs/project/evidence/phase-01/dotnet-test.log"
}
